<?xml version="1.0" encoding="utf-8" standalone="no"?>
<!DOCTYPE auto-showroom SYSTEM "AutoShowRoom.dtd">
<auto-showroom>
    <showroomName>АутоБрон</showroomName>
    <cars>
        <car car-id="a8-c101" added-by="a8-e3" in-stock="t" new = "f" total-orders = "2" country-of-origin = "Япония">
            <brand>Нисан</brand>
            <model>Алмера</model>
            <power>324 к.с.</power>
            <fuel>бензин</fuel>
            <description>Японски спортен седан.</description>
            <class>седан</class>
            <price>9500 лв.</price>
			<color>сив</color>
			<weight>1320 кг.</weight>
			<safety-rating> 4/5 </safety-rating>
            <seats>5</seats>
        </car>
        <car car-id="a8-c102" added-by="a8-e2" in-stock="f" new = "f" total-orders = "2" country-of-origin = "САЩ">
            <brand>Форд</brand>
            <model>Мустанг</model>
            <power>290 к.с.</power>
            <fuel>бензин</fuel>
            <description>Американска спортна кола.</description>
            <class>купе</class>
            <price>24500 лв.</price>
			<color>сив</color>
			<weight>1720 кг.</weight>
			<safety-rating> 2/5 </safety-rating>
            <seats>4</seats>
        </car>
        <car car-id="a8-c103" added-by="a8-e2" in-stock="t" new = "f" total-orders = "2" country-of-origin = "Германия">
            <brand>Порше</brand>
            <model>Панамера</model>
            <power>280 к.с.</power>
            <fuel>бензин</fuel>
            <description>Спортен немски седан.</description>
            <class>седан</class>
            <price>110000 лв.</price>
			<color>червен</color>
			<weight>1820 кг.</weight>
			<safety-rating> 5/5 </safety-rating>
            <seats>5</seats>
        </car>
        <car car-id="a8-c104" added-by="a8-e1" in-stock="t" new = "f" total-orders = "2" country-of-origin = "Германия">
            <brand>Мерцедес</brand>
            <model>СЛ500</model>
            <power>320 к.с.</power>
            <fuel>бензин</fuel>
            <description>Луксозно просторно кабрио.</description>
            <class>купе</class>
            <price>65000 лв.</price>
			<color>сив</color>
			<weight>1520 кг.</weight>
			<safety-rating> 5/5 </safety-rating>
            <seats>2</seats>
        </car> 
        <car car-id="a8-c105" added-by="a8-e1" in-stock="t" new = "f" total-orders = "2" country-of-origin = "Германия">
            <brand>Ауди</brand>
            <model>Ку7</model>
            <power>385 к.с.</power>
            <fuel>бензин</fuel>
            <description>Немски луксозен джип.</description>
            <class>джип</class>
            <price>110000 лв.</price>
			<color>сив</color>
			<weight>1920 кг.</weight>
			<safety-rating> 5/5 </safety-rating>
            <seats>5</seats>
        </car>
    </cars>
    <employees>
        <employee employee-id="a8-e1">
            <employee-name>Пламен Стоянов</employee-name>
			<employee-salary> 4500 лв.</employee-salary>
            <employee-position>собственик</employee-position>
        </employee>
        <employee employee-id="a8-e2">
            <employee-name>Стилян Сотиров</employee-name>
			<employee-salary> 3500 лв.</employee-salary>
            <employee-position>мениджър</employee-position>
        </employee>
        <employee employee-id="a8-e3">
            <employee-name>Николай Белурев</employee-name>
			<employee-salary> 3500 лв.</employee-salary>
            <employee-position>механик</employee-position>
        </employee>
    </employees>
    <orders>        
        <order order-id="a8-or1" ordered-products="a8-c102" processed-by="a8-e2">
            <order-date>01.01.2016</order-date>
            <total-price>24500лв.</total-price>
            <client-info>
                <client-name>Стоян Иванов</client-name>
                <client-address>
                    <city>Варна</city>
                    <address>жк.Свобода, бл17Б ет.5 ап.42</address>
                </client-address>
                <client-telephone>087864852</client-telephone>
            </client-info>
        </order>
    </orders>
</auto-showroom>