<?xml version="1.0" encoding="utf-8" standalone="no"?>
<!DOCTYPE auto-showroom SYSTEM "AutoShowRoom.dtd">
<auto-showroom>
    <showroomName>АутоШампион</showroomName>
    <cars>
        <car car-id="a17-c101" added-by="a17-e2" in-stock="t" new = "f" total-orders = "2" country-of-origin = "Германия">
            <brand>Мерцедес</brand>
            <model>Е300</model>
            <power>250 к.с.</power>
            <fuel>бензин</fuel>
            <description>Просторна семейна кола с голям багажник и мощен двигател.</description>
            <class>седан</class>
            <price>6500 лв.</price>
			<color>сив</color>
			<weight>1520 кг.</weight>
			<safety-rating> 5/5 </safety-rating>
            <seats>5</seats>
        </car>
        <car car-id="a17-c102" added-by="a17-e1" in-stock="t" new = "f" total-orders = "2" country-of-origin = "Германия">
            <brand>Ауди</brand>
            <model>А3</model>
            <power>115 к.с.</power>
            <fuel>дизел</fuel>
            <description>Евтин семеен седан.</description>
            <class>седан</class>
            <price>3500 лв.</price>
			<color>бял</color>
			<weight>1460 кг.</weight>
			<safety-rating> 5/5 </safety-rating>
            <seats>5</seats>
        </car>
        <car car-id="a17-c103" added-by="a17-e3" in-stock="t" new = "f" total-orders = "2" country-of-origin = "Германия">
            <brand>БМВ</brand>
            <model>740</model>
            <power>325 к.с.</power>
            <fuel>бензин</fuel>
            <description>Спортен луксозен автомобил.</description>
            <class>седан</class>
            <price>14000 лв.</price>
			<color>сив</color>
			<weight>1720 кг.</weight>
			<safety-rating> 5/5 </safety-rating>
            <seats>5</seats>
        </car>
        <car car-id="a17-c104" added-by="a17-e4" in-stock="t" new = "f" total-orders = "2" country-of-origin = "Германия">
            <brand>Мерцедес</brand>
            <model>Ц200</model>
            <power>135 к.с.</power>
            <fuel>бензин</fuel>
            <description>Малък немски седан.</description>
            <class>седан</class>
            <price>6300 лв.</price>
			<color>сив</color>
			<weight>1520 кг.</weight>
			<safety-rating> 5/5 </safety-rating>
            <seats>5</seats>
        </car> 
        <car car-id="a17-c105" added-by="a17-e1" in-stock="t" new = "f" total-orders = "2" country-of-origin = "Германия">
            <brand>Фолксваген</brand>
            <model>Пасат</model>
            <power>100 к.с.</power>
            <fuel>дизел</fuel>
            <description>Евтина и икономична алтернатива.</description>
            <class>седан</class>
            <price>1900 лв.</price>
			<color>червен</color>
			<weight>1470 кг.</weight>
			<safety-rating> 5/5 </safety-rating>
            <seats>5</seats>
        </car>
    </cars>
    <employees>
        <employee employee-id="a17-e1">
            <employee-name>Петър Иванов</employee-name>
			<employee-salary> 4500 лв.</employee-salary>
            <employee-position>собственик</employee-position>
        </employee>
        <employee employee-id="a17-e2">
            <employee-name>Йордан Петканов</employee-name>
			<employee-salary> 3500 лв.</employee-salary>
            <employee-position>мениджър</employee-position>
        </employee>
        <employee employee-id="a17-e3">
            <employee-name>Асен Миноров</employee-name>
			<employee-salary> 1500 лв.</employee-salary>
            <employee-position>асистент</employee-position>
        </employee>
        <employee employee-id="a17-e4">
            <employee-name>Християн Петров</employee-name>
			<employee-salary> 1500 лв.</employee-salary>
            <employee-position>асистент</employee-position>
        </employee>
        <employee employee-id="a17-e5">
            <employee-name>Валентин Михайлов</employee-name>
			<employee-salary> 1500 лв.</employee-salary>
            <employee-position>механик</employee-position>
        </employee>
    </employees>
    <orders>
        <order order-id="a17-or1" ordered-products="a17-c102" processed-by="a17-e3">
            <order-date>11.12.2015</order-date>
            <total-price>3500 лв.</total-price>
            <client-info>
                <client-name>Кристиян Петранов</client-name>
                <client-address>
                    <city>София</city>
                    <address>жк.Красно село, бл125А ет.2 ап.13</address>
                </client-address>
                <client-telephone>0888152355</client-telephone>
            </client-info>
        </order>
        <order order-id="a17-or2" ordered-products="a17-c104" processed-by="a17-e3">
            <order-date>14.12.2015</order-date>
            <total-price>6300 лв.</total-price>
            <client-info>
                <client-name>Петър Мирков</client-name>
                <client-address>
                    <city>София</city>
                    <address>жк.Права ливада, бл12А ет.1 ап.2</address>
                </client-address>
                <client-telephone>087252455</client-telephone>
            </client-info>
        </order>
    </orders>
</auto-showroom>